,연번,역번호,호선,역명,역주소,위도,경도,구별
224,225,2724,7,사가정,서울특별시 중랑구 사가정로 지하393 (면목동),127.0884391,37.58079455,중랑구
225,226,2725,7,용마산,서울특별시 중랑구 용마산로 지하227 (면목동),127.0870381,37.57403021,중랑구
226,227,2726,7,중곡,서울특별시 광진구 능동로 지하417 (중곡동),127.0840724,37.56552588,광진구
227,228,2727,7,군자,서울특별시 광진구 천호대로 지하550,127.0790173,37.55736319,광진구
228,229,2728,7,어린이대공원,서울특별시 광진구 능동로 지하210 (화양동),127.0745499,37.5478712,광진구
229,230,2729,7,건대입구,서울특별시 광진구 능동로110(화양동6-3),127.0714119,37.54065794,광진구
230,231,2730,7,뚝섬유원지,서울특별시 광진구 능동로 10 (자양동),127.0667177,37.53158626,광진구
231,232,2731,7,청담,서울특별시 강남구 학동로 지하508 (청담동),127.0536445,37.51944066,강남구
232,233,2732,7,강남구청,서울특별시 강남구 학동로 지하346 (삼성동),127.0413014,37.51718924,강남구
233,234,2733,7,학동,서울특별시 강남구 학동로 지하180 (논현동),127.0314638,37.51420643,강남구
234,235,2734,7,논현,서울특별시 강남구 학동로 지하102(논현동),127.0216579,37.51119883,강남구
235,236,2735,7,반포,서울특별시 서초구 신반포로 지하241(잠원동),127.011497,37.50812639,서초구
236,237,2736,7,고속터미널,서울특별시 서초구 신반포로 지하 188 (반포동),127.0044421,37.50464718,서초구
237,238,2737,7,내방,서울특별시 서초구 서초대로 지하103 (방배동),126.9931903,37.48753353,서초구
238,239,2738,7,이수,서울특별시 동작구 사당로 지하310 (사당동),126.9810218,37.48501514,동작구
239,240,2739,7,남성,서울특별시 동작구 사당로 지하218 (사당동),126.9717061,37.48444339,동작구
240,241,2740,7,숭실대입구,서울특별시 동작구 상도로 지하 378,126.9540602,37.49581433,동작구
241,242,2741,7,상도,서울특별시 동작구 상도로 지하272 (상도1동),126.9477004,37.50320805,동작구
242,243,2742,7,장승배기,서울특별시 동작구 상도로 지하188 (상도동),126.9387444,37.5046658,동작구
243,244,2743,7,신대방삼거리,서울특별시 동작구 상도로 지하76 (대방동) ,126.928223,37.49972183,동작구
244,245,2744,7,보라매,서울특별시 동작구 상도로 지하2 (대방동),126.9204894,37.49991005,동작구
245,246,2745,7,신풍,서울특별시 영등포구 신풍로 지하27 (신길동),126.9098417,37.5001172,영등포구
246,247,2746,7,대림,서울특별시 영등포구 도림로 지하137,126.8966118,37.49274307,영등포구
247,248,2747,7,남구로,서울특별시 구로구 도림로 지하7 (구로동),126.887341,37.48616184,구로구
248,249,2748,7,가산디지털단지,서울특별시 금천구 벚꽃로 309 (가산동),126.8825595,37.48159574,금천구
249,250,2749,7,철산,경기도 광명시 철산로 지하13 (철산동),126.8680039,37.47609801,광명시
250,251,2750,7,광명사거리,경기도 광명시 오리로 지하980(광명동),126.8547032,37.47933558,광명시
251,252,2751,7,천왕,서울특별시 구로구 오리로 지하1154(오류동),126.8387137,37.48682194,구로구
252,253,2752,7,온수,서울특별시 구로구 경인로3길 지하64 (온수동),126.8233807,37.49215028,구로구
253,254,2753,7,까치울,경기도 부천시 길주로 626 ,126.8113983,37.50619978,부천시
254,255,2754,7,부천종합운동장,경기도 부천시 길주로 지하 502 ,126.79743,37.50548324,부천시
255,256,2755,7,춘의,경기도 부천시 길주로 지하 406 ,126.7868664,37.50364409,부천시
256,257,2756,7,신중동,경기도 부천시 길주로 314 ,126.7764991,37.50297215,부천시
257,258,2757,7,부천시청,경기도 부천시 길주로 202 ,126.7640604,37.50464221,부천시
258,259,2758,7,상동,경기도 부천시 길주로 104 ,126.753187,37.50580985,부천시
259,260,2759,7,삼산체육관,인천광역시 부평구 길주로 지하713 (삼산동),126.7419066,37.5065825,부평구
260,261,2760,7,굴포천,인천광역시 부평구 길주로 지하623 (삼산동),126.7317624,37.50707843,부평구
261,262,2761,7,부평구청,인천광역시 부평구 길주로 지하527(갈산동),126.7208572,37.50760647,부평구
262,263,2811,8,암사,서울특별시 강동구 올림픽로 지하776 (암사동),127.1275402,37.55014034,강동구
263,264,2812,8,천호,서울특별시 강동구 천호대로 지하997 (천호동),127.1237424,37.53857898,강동구
264,265,2813,8,강동구청,서울특별시 강동구 올림픽로 지하550 (성내동),127.1205761,37.53067409,강동구
265,266,2814,8,몽촌토성,서울특별시 송파구 올림픽로 지하383,127.1124299,37.51762363,송파구
266,267,2815,8,잠실,서울특별시 송파구 올림픽로 지하 265 (잠실동),127.1018579,37.51385928,송파구
267,268,2816,8,석촌,서울특별시 송파구 송파대로 지하439 (석촌동),127.1063453,37.50594964,송파구
268,269,2817,8,송파,서울특별시 송파구 송파대로 지하354 (가락동),127.1121799,37.49968667,송파구
269,270,2818,8,가락시장,서울특별시 송파구 송파대로 지하 257 (가락동),127.1184857,37.49274403,송파구
270,271,2819,8,문정,서울특별시 송파구 송파대로 지하179 (문정동),127.1222903,37.48626182,송파구
271,272,2820,8,장지,서울특별시 송파구 송파대로 지하82 (장지동),127.1264242,37.47811921,송파구
272,273,2821,8,복정,서울특별시 송파구 송파대로 지하6 (장지동),127.1267712,37.471056,송파구
273,274,2822,8,산성,경기도 성남시 수정구 수정로 지하365(신흥동),127.1499435,37.45652458,성남시
274,275,2823,8,남한산성입구,경기도 성남시 수정구 산성대로 지하 445,127.1598025,37.45156834,성남시
275,276,2824,8,단대오거리,경기도 성남시 수정구 산성대로 지하365 (신흥동),127.1566879,37.44514315,성남시
276,277,2825,8,신흥,경기도 성남시 수정구 산성대로 지하280 (신흥동),127.1481076,37.44118408,성남시
277,278,2826,8,수진,경기도 성남시 수정구 산성대로 지하200 (수진동),127.1403519,37.43745947,성남시
278,279,2827,8,모란,경기도 성남시 수정구 산성대로 지하100 (수진동),127.1295512,37.43385017,성남시
279,280,4126,9,언주,서울특별시 강남구 봉은사로 지하 201,127.0342847,37.5074455,강남구
280,281,4127,9,선정릉,서울특별시 강남구 선릉로 지하 580,127.043641,37.51085389,강남구
281,282,4128,9,삼성중앙,서울특별시 강남구 봉은사로 지하 501,127.0527057,37.51288303,강남구
282,283,4129,9,봉은사,서울특별시 강남구 봉은사로 지하 601,127.0608919,37.51436062,강남구
283,284,4130,9,종합운동장,서울특별시 송파구 올림픽로 지하 23 (잠실동),127.073356,37.51096927,송파구
284,285,4131,9,삼전,서울특별시 송파구 백제고분로 187,127.0877816,37.5047453,송파구
285,286,4132,9,석촌고분,서울특별시 송파구 삼학사로 53,127.096617,37.50201881,송파구
286,287,4133,9,석촌,서울특별시 송파구 송파대로 439,127.1063453,37.50594964,송파구
287,288,4134,9,송파나루,서울특별시 송파구 오금로 165,127.1131232,37.51012031,송파구
288,289,4135,9,한성백제,서울특별시 송파구 위례성대로 51,127.1181845,37.51686487,송파구
289,290,4136,9,올림픽공원,서울특별시 송파구 양재대로 1233,127.1306001,37.51608765,송파구
290,291,4137,9,둔촌오륜,서울특별시 강동구 강동대로 303,127.1384273,37.51942425,강동구
291,292,4138,9,중앙보훈병원,서울특별시 강동구 명일로 117,127.148542,37.52889572,강동구
